Beat_ID,Life_Phase,Beat_Type,Content_Sketch,Mood_Tag,Beat_Duration_Sec,Scene_Type,Illustration_Note
BEAT_01_01,HOOK,ESTABLISH,"Handshake in European cafe - warm smile across the table, coffee, cobblestone outside the window. You know their real name. They do not know yours.",WONDER,38,NARRATIVE_SCENE,"Warm cafe interior, two stickmen at small table, handshake, window showing European street"
BEAT_01_02,HOOK,CONSTRAINT,"Weight statement: you have never told anyone who you are. Not even the person sitting next to you every day. The cost of two lives.",WONDER,48,TEXT_OVERLAY,"Bold white text on dark: 'They trust you. That is how you win.'"
BEAT_02_01,PHASE_EARLY,ESTABLISH,"Age 21. Elite IDF unit. You are noticed by someone you never see. A phone call with no organization name. An invitation you cannot refuse.",WONDER,35,NARRATIVE_SCENE,"Young stickman in olive IDF uniform, holding phone, military base background"
BEAT_02_02,PHASE_EARLY,CONSTRAINT,"Months of psychological screening. Simulations under assumed identities. Stress tests that strip you down. They want to know if you can become someone else.",TENSION,42,NARRATIVE_SCENE,"Stickman in civilian clothes at interview table, two faceless evaluators across, stark room"
BEAT_02_03,PHASE_EARLY,ESTABLISH,"Midrasha academy near Herzliya. Two years. Surveillance detection, source recruitment, cover management. You learn to lie with your whole body.",TENSION,40,NARRATIVE_SCENE,"Training facility exterior, group of stickmen in dark civilian clothes, Herzliya cityscape"
BEAT_02_04,PHASE_EARLY,CONSTRAINT,"Final exercise: three weeks in a foreign city under a fake name. No one knows who you are. By the end you respond to the fake name without thinking. You graduate. No diploma. No photo.",TENSION,40,NARRATIVE_SCENE,"Stickman walking alone on European street with bag, nighttime, new identity documents in hand"
BEAT_03_01,PHASE_CONFLICT,ESTABLISH,"Deployed to a European capital. New identity: businessman. An apartment with someone else's name on the lease. A cafe where you become a regular.",TENSION,38,NARRATIVE_SCENE,"Stickman in blazer entering warm-lit cafe, European architecture, apartment building visible"
BEAT_03_02,PHASE_CONFLICT,CONFLICT,"First target: a man with access. You meet by coincidence - except nothing is coincidence. Coffee. Then dinner. Then birthdays. You build trust brick by brick.",TENSION,42,NARRATIVE_SCENE,"Two stickmen at restaurant table, wine glasses, stickman with glasses (target) talking warmly"
BEAT_03_03,PHASE_CONFLICT,CONFLICT,"Target starts to share private things - family fears, childhood memories, his daughter's school. You listen. You nod. You file every word into a report marked CLASSIFIED.",TENSION,45,NARRATIVE_SCENE,"Close view of two stickmen talking, SUBJECT writing in notebook later at safe house desk, warm vs cold split"
BEAT_03_04,PHASE_CONFLICT,REFLECT,"Phone call home to Israel. Your wife's voice. Your daughter asks when Abba is coming home. You say soon. You have said soon for eleven months.",LONGING,38,EMOTIONAL_CLOSEUP,"Stickman holding phone in dark apartment, window showing European city at night, isolated"
BEAT_03_05,PHASE_CONFLICT,CONSTRAINT,"Sayanim network: a stranger gives you a car. Another gives you a room. Documents appear. No one asks why. You live in a shadow infrastructure built on loyalty you cannot repay.",TENSION,37,NARRATIVE_SCENE,"Stickman receiving car keys from faceless figure in parking garage, no words exchanged"
BEAT_04_01,PHASE_CRISIS,CONFLICT,"Target invites you to dinner at his home. His wife cooks. His daughter - same age as yours - runs circles around the table laughing.",DREAD,32,NARRATIVE_SCENE,"Dinner table scene, target family + SUBJECT, warm lighting, child running, wine being poured"
BEAT_04_02,PHASE_CRISIS,CRISIS,"Phone buzzes in your pocket. Code word: Activate. You keep smiling. You keep talking. No one at the table notices anything. You pour yourself more wine.",DREAD,35,NARRATIVE_SCENE,"SUBJECT at dinner table, phone glow from pocket, frozen smile, everyone else laughing"
BEAT_04_03,PHASE_CRISIS,CRISIS,"You could refuse. You could stand up and tell the truth. No gun to your head. No immediate threat. This is a choice. And you choose to continue.",DREAD,28,EMOTIONAL_CLOSEUP,"SUBJECT's face close-up, dot eyes fixed, hand on wine glass, deliberate stillness"
BEAT_04_04,PHASE_CRISIS,REFLECT,"You extract what you need. You say goodnight at the door. They hug you. The next morning your apartment is empty. Your phone number no longer exists. Two weeks later you read the news.",DREAD,38,NARRATIVE_SCENE,"Split: left - goodbye hug at door; right - empty apartment, stripped clean, morning light"
BEAT_05_01,PHASE_RESOLUTION,CONFLICT,"Next mission. Then the next. You stop counting. Faces blur. Names blur. Only the wristwatch stays the same.",BITTERSWEET,30,NARRATIVE_SCENE,"Montage: multiple cafe meetings, different cities, same blazer, same watch, faces changing"
BEAT_05_02,PHASE_RESOLUTION,REFLECT,"Back in Israel between missions. Your daughter runs to her mother instead of you. Your wife says she does not know who you are anymore. Neither do you.",BITTERSWEET,35,NARRATIVE_SCENE,"Israeli apartment, daughter running past SUBJECT to mother, harsh white sunlight, empty feeling"
BEAT_05_03,PHASE_RESOLUTION,RESOLVE,"Leave Mossad. No ceremony. No medal. No one says thank you. You sit in a Tel Aviv cafe and someone calls a name. You flinch. Which name?",BITTERSWEET,32,NARRATIVE_SCENE,"SUBJECT in grey shirt at Tel Aviv cafe, flinching, bright daylight, alone at table"
BEAT_05_04,PHASE_RESOLUTION,REFLECT,"Therapist asks what trauma you experienced. You are not allowed to answer. You Google your old target's name. Social media still there. Family photos. Smiles. You close the laptop.",BITTERSWEET,38,NARRATIVE_SCENE,"Split: therapist office (SUBJECT silent) / laptop screen showing social media photos, then closed"
BEAT_06_01,CALLBACK,CALLBACK,"Another cafe. Another person across from you. But this time no mission. No handler. No file. Your hands still scan exits and count faces by reflex.",BITTERSWEET,28,NARRATIVE_SCENE,"Tel Aviv cafe, SUBJECT in grey shirt, coffee, watching the room, wristwatch visible, quiet"
BEAT_06_02,CALLBACK,CTA,"You lived two lives. And now you do not know which one was real. If you ever wondered what it costs to build trust for a living - now you know.",BITTERSWEET,22,TEXT_OVERLAY,"Bold white text on dark: 'You lived two lives. And now you do not know which one was real.'"
