VO_ID,Episode_ID,Beat_ID,Life_Phase,Beat_Type,VO_Type,VO_EN,Word_Count_EN,Pause_After
275,PV_0014,BEAT_05_04,PHASE_RESOLUTION,RESOLVE,NARRATION,"No game controller.",3,0
276,PV_0014,BEAT_05_04,PHASE_RESOLUTION,RESOLVE,NARRATION,"No arbitrage to run.",4,0
277,PV_0014,BEAT_05_04,PHASE_RESOLUTION,RESOLVE,NARRATION,"No system to optimize.",4,0
278,PV_0014,BEAT_05_04,PHASE_RESOLUTION,RESOLVE,NARRATION,"No one to save.",4,0.5
279,PV_0014,BEAT_05_04,PHASE_RESOLUTION,RESOLVE,NARRATION,"The walls are the same color as the ceiling.",8,0
280,PV_0014,BEAT_05_04,PHASE_RESOLUTION,RESOLVE,NARRATION,"You never noticed that before about rooms.",7,0.5
281,PV_0014,BEAT_05_04,PHASE_RESOLUTION,RESOLVE,NARRATION,"Twenty-six billion became zero.",4,0
282,PV_0014,BEAT_05_04,PHASE_RESOLUTION,RESOLVE,WEIGHT_LINE,"But zero was never yours either.",6,0
283,PV_0014,BEAT_05_04,PHASE_RESOLUTION,RESOLVE,NARRATION,"It belonged to eight million people who trusted you.",8,1.0
284,PV_0014,BEAT_05_04,PHASE_RESOLUTION,RESOLVE,NARRATION,"You don't like thinking about any of this.",8,1.0
285,PV_0014,BEAT_06_01,CALLBACK,CALLBACK,NARRATION,"The screen is off.",4,0
286,PV_0014,BEAT_06_01,CALLBACK,CALLBACK,NARRATION,"The room is dark.",4,0
287,PV_0014,BEAT_06_01,CALLBACK,CALLBACK,NARRATION,"No spread to capture.",4,0
288,PV_0014,BEAT_06_01,CALLBACK,CALLBACK,NARRATION,"No system to fix.",4,0
289,PV_0014,BEAT_06_01,CALLBACK,CALLBACK,NARRATION,"No philosophy to justify what comes next.",6,1.0
290,PV_0014,BEAT_06_01,CALLBACK,CALLBACK,NARRATION,"Just a room.",3,0
291,PV_0014,BEAT_06_01,CALLBACK,CALLBACK,WEIGHT_LINE,"And the quiet.",3,1.5
292,PV_0014,BEAT_06_02,CALLBACK,CTA,NARRATION,"You wanted to become the person who saves the world.",9,0.5
293,PV_0014,BEAT_06_02,CALLBACK,CTA,WEIGHT_LINE,"You couldn't save yourself.",4,2.0
