VO_ID,Episode_ID,Beat_ID,Life_Phase,Beat_Type,VO_Type,VO_EN,Word_Count_EN,Pause_After
1,PV_0014,BEAT_01_01,HOOK,ESTABLISH,NARRATION,"The number on the screen says twenty-six billion.",8,0
2,PV_0014,BEAT_01_01,HOOK,ESTABLISH,NARRATION,"It's the largest number you've ever seen attached to your name.",11,0
3,PV_0014,BEAT_01_01,HOOK,ESTABLISH,NARRATION,"You don't think of it as money.",7,0
4,PV_0014,BEAT_01_01,HOOK,ESTABLISH,NARRATION,"You think of it as proof.",5,0
5,PV_0014,BEAT_01_01,HOOK,ESTABLISH,WEIGHT_LINE,"Proof you were right about everything.",6,1.5
6,PV_0014,BEAT_01_01,HOOK,ESTABLISH,NARRATION,"Seventy-two hours from now, that number will be zero.",9,0.5
7,PV_0014,BEAT_01_01,HOOK,ESTABLISH,NARRATION,"And everyone who trusted you will learn the truth at the same time.",12,0
8,PV_0014,BEAT_01_01,HOOK,ESTABLISH,NARRATION,"You just don't know that yet.",6,1.0
9,PV_0014,BEAT_01_02,HOOK,CONSTRAINT,NARRATION,"You're standing in a federal courtroom.",6,0
10,PV_0014,BEAT_01_02,HOOK,CONSTRAINT,NARRATION,"The lights are too white.",5,0
11,PV_0014,BEAT_01_02,HOOK,CONSTRAINT,NARRATION,"You're wearing a suit someone else picked out.",8,0.5
12,PV_0014,BEAT_01_02,HOOK,CONSTRAINT,NARRATION,"Three years ago you wore cargo shorts to testify before Congress.",10,0
13,PV_0014,BEAT_01_02,HOOK,CONSTRAINT,NARRATION,"Nobody stopped you.",3,0
14,PV_0014,BEAT_01_02,HOOK,CONSTRAINT,NARRATION,"Nobody thought that was a problem.",5,0.5
15,PV_0014,BEAT_01_02,HOOK,CONSTRAINT,NARRATION,"You didn't think you were gambling.",6,0
16,PV_0014,BEAT_01_02,HOOK,CONSTRAINT,WEIGHT_LINE,"You thought you could fix it before anyone noticed.",9,2.0
17,PV_0014,BEAT_01_03,HOOK,ESTABLISH,WEIGHT_LINE,"You gambled with eight million people's money.",7,0
18,PV_0014,BEAT_01_03,HOOK,ESTABLISH,WEIGHT_LINE,"And you lost.",3,2.0
19,PV_0014,BEAT_02_01,PHASE_EARLY,ESTABLISH,NARRATION,"You grow up on a university campus.",7,0
20,PV_0014,BEAT_02_01,PHASE_EARLY,ESTABLISH,NARRATION,"Faculty housing.",2,0
21,PV_0014,BEAT_02_01,PHASE_EARLY,ESTABLISH,NARRATION,"Trees everywhere.",2,0
22,PV_0014,BEAT_02_01,PHASE_EARLY,ESTABLISH,NARRATION,"Your parents are both professors.",5,0
23,PV_0014,BEAT_02_01,PHASE_EARLY,ESTABLISH,NARRATION,"Law.",1,0
24,PV_0014,BEAT_02_01,PHASE_EARLY,ESTABLISH,NARRATION,"The most elite school in the country.",7,0.5
25,PV_0014,BEAT_02_01,PHASE_EARLY,ESTABLISH,NARRATION,"Your mother teaches ethics.",4,0
26,PV_0014,BEAT_02_01,PHASE_EARLY,ESTABLISH,NARRATION,"Your father teaches tax law.",5,0
27,PV_0014,BEAT_02_01,PHASE_EARLY,ESTABLISH,NARRATION,"Dinner is a debate.",4,0
28,PV_0014,BEAT_02_01,PHASE_EARLY,ESTABLISH,NARRATION,"Breakfast is a correction.",4,0
29,PV_0014,BEAT_02_01,PHASE_EARLY,ESTABLISH,NARRATION,"You learn to argue before you learn to listen.",8,0.5
30,PV_0014,BEAT_02_01,PHASE_EARLY,ESTABLISH,NARRATION,"You're the smartest kid in every room you walk into.",10,0
31,PV_0014,BEAT_02_01,PHASE_EARLY,ESTABLISH,NARRATION,"You finish tests before anyone else.",6,0
32,PV_0014,BEAT_02_01,PHASE_EARLY,ESTABLISH,NARRATION,"You read textbooks the way other kids read comics.",9,0
33,PV_0014,BEAT_02_01,PHASE_EARLY,ESTABLISH,NARRATION,"A kid tries to sit with you at lunch once.",8,0
34,PV_0014,BEAT_02_01,PHASE_EARLY,ESTABLISH,NARRATION,"You don't know if he's being nice or if his parents told him to.",13,0.5
35,PV_0014,BEAT_02_01,PHASE_EARLY,ESTABLISH,WEIGHT_LINE,"You can't connect with a single person in any of them.",10,1.5
36,PV_0014,BEAT_02_01,PHASE_EARLY,ESTABLISH,NARRATION,"Systems make more sense.",4,0
37,PV_0014,BEAT_02_01,PHASE_EARLY,ESTABLISH,NARRATION,"Numbers don't change their mind.",5,0
38,PV_0014,BEAT_02_01,PHASE_EARLY,ESTABLISH,NARRATION,"People do.",2,0
39,PV_0014,BEAT_02_01,PHASE_EARLY,ESTABLISH,NARRATION,"You decide early that people are a variable you can't optimize.",10,0.5
40,PV_0014,BEAT_02_02,PHASE_EARLY,REFLECT,TIME_MARKER,"You are fourteen.",3,1.0
41,PV_0014,BEAT_02_02,PHASE_EARLY,REFLECT,NARRATION,"You find a philosophy that changes everything.",7,0.5
42,PV_0014,BEAT_02_02,PHASE_EARLY,REFLECT,NARRATION,"Earn as much money as you possibly can.",7,0
43,PV_0014,BEAT_02_02,PHASE_EARLY,REFLECT,NARRATION,"Then give it all away.",5,0
44,PV_0014,BEAT_02_02,PHASE_EARLY,REFLECT,NARRATION,"Not some.",2,0
45,PV_0014,BEAT_02_02,PHASE_EARLY,REFLECT,WEIGHT_LINE,"All of it.",3,1.0
46,PV_0014,BEAT_02_02,PHASE_EARLY,REFLECT,NARRATION,"The math is simple.",4,0
47,PV_0014,BEAT_02_02,PHASE_EARLY,REFLECT,NARRATION,"One hedge fund manager's salary can fund malaria nets for an entire country.",12,0
48,PV_0014,BEAT_02_02,PHASE_EARLY,REFLECT,NARRATION,"More lives saved than any doctor.",6,0
49,PV_0014,BEAT_02_02,PHASE_EARLY,REFLECT,NARRATION,"More than any politician.",4,0
50,PV_0014,BEAT_02_02,PHASE_EARLY,REFLECT,NARRATION,"More than anyone.",3,0.5
51,PV_0014,BEAT_02_02,PHASE_EARLY,REFLECT,NARRATION,"For the first time in your life, the numbers and the morality point the same direction.",14,0.5
52,PV_0014,BEAT_02_02,PHASE_EARLY,REFLECT,NARRATION,"The purpose isn't money.",4,0
53,PV_0014,BEAT_02_02,PHASE_EARLY,REFLECT,WEIGHT_LINE,"The purpose is maximizing impact.",5,1.5
54,PV_0014,BEAT_02_02,PHASE_EARLY,REFLECT,NARRATION,"That sentence will follow you to a courtroom.",7,0
55,PV_0014,BEAT_02_22,PHASE_EARLY,REFLECT,NARRATION,"But you don't know that yet.",6,1.0
56,PV_0014,BEAT_02_03,PHASE_EARLY,ESTABLISH,NARRATION,"You graduate with a physics degree.",6,0
57,PV_0014,BEAT_02_03,PHASE_EARLY,ESTABLISH,NARRATION,"Not because you love physics.",5,0
58,PV_0014,BEAT_02_03,PHASE_EARLY,ESTABLISH,NARRATION,"Because it teaches you how systems work.",6,0.5
59,PV_0014,BEAT_02_03,PHASE_EARLY,ESTABLISH,NARRATION,"You get a job at a trading desk.",7,0
60,PV_0014,BEAT_02_03,PHASE_EARLY,ESTABLISH,NARRATION,"Suits.",1,0
61,PV_0014,BEAT_02_03,PHASE_EARLY,ESTABLISH,NARRATION,"Ties.",1,0
62,PV_0014,BEAT_02_03,PHASE_EARLY,ESTABLISH,NARRATION,"Money moving in fractions of a second.",6,0.5
63,PV_0014,BEAT_02_03,PHASE_EARLY,ESTABLISH,NARRATION,"You learn that money has cracks.",6,0
64,PV_0014,BEAT_02_03,PHASE_EARLY,ESTABLISH,NARRATION,"Tiny differences between what something costs here and what it costs there.",11,0
65,PV_0014,BEAT_02_03,PHASE_EARLY,ESTABLISH,NARRATION,"Arbitrage.",1,0
66,PV_0014,BEAT_02_03,PHASE_EARLY,ESTABLISH,NARRATION,"You're good at finding the cracks.",6,0
67,PV_0014,BEAT_02_03,PHASE_EARLY,ESTABLISH,NARRATION,"Better than most people in the room.",6,0
68,PV_0014,BEAT_02_03,PHASE_EARLY,ESTABLISH,NARRATION,"The desk is cold under your wrists.",7,0
69,PV_0014,BEAT_02_03,PHASE_EARLY,ESTABLISH,NARRATION,"You don't mind.",3,0.5
70,PV_0014,BEAT_02_03,PHASE_EARLY,ESTABLISH,NARRATION,"Then you notice something.",4,0
71,PV_0014,BEAT_02_03,PHASE_EARLY,ESTABLISH,NARRATION,"Crypto has wider cracks.",4,0
72,PV_0014,BEAT_02_03,PHASE_EARLY,ESTABLISH,NARRATION,"Much wider.",2,0
73,PV_0014,BEAT_02_03,PHASE_EARLY,ESTABLISH,NARRATION,"Money sitting there.",3,0
74,PV_0014,BEAT_02_03,PHASE_EARLY,ESTABLISH,WEIGHT_LINE,"Uncollected.",1,1.0
75,PV_0014,BEAT_02_04,PHASE_EARLY,TIME_MARKER,TIME_MARKER,"You are twenty-five.",4,1.0
76,PV_0014,BEAT_02_04,PHASE_EARLY,TIME_MARKER,NARRATION,"You quit.",2,0
77,PV_0014,BEAT_02_04,PHASE_EARLY,TIME_MARKER,NARRATION,"Your boss thinks you're making a mistake.",7,0
78,PV_0014,BEAT_02_04,PHASE_EARLY,TIME_MARKER,NARRATION,"You don't care.",3,0.5
79,PV_0014,BEAT_02_04,PHASE_EARLY,TIME_MARKER,NARRATION,"You rent an apartment.",4,0
80,PV_0014,BEAT_02_04,PHASE_EARLY,TIME_MARKER,NARRATION,"Mattresses on the floor.",4,0
81,PV_0014,BEAT_02_04,PHASE_EARLY,TIME_MARKER,NARRATION,"Screens on every surface.",4,0
82,PV_0014,BEAT_02_04,PHASE_EARLY,TIME_MARKER,NARRATION,"The air smells like instant noodles and old carpet.",9,0
83,PV_0014,BEAT_02_04,PHASE_EARLY,TIME_MARKER,NARRATION,"You don't remember the last time you left before midnight.",10,0
84,PV_0014,BEAT_02_04,PHASE_EARLY,TIME_MARKER,NARRATION,"You don't mind that either.",5,0.5
85,PV_0014,BEAT_02_04,PHASE_EARLY,TIME_MARKER,NARRATION,"You're not building a company.",5,0
86,PV_0014,BEAT_02_04,PHASE_EARLY,TIME_MARKER,WEIGHT_LINE,"You're building a machine to save the world.",8,1.0
87,PV_0014,BEAT_02_04,PHASE_EARLY,TIME_MARKER,NARRATION,"At least that's what you tell yourself.",7,0
88,PV_0014,BEAT_02_04,PHASE_EARLY,TIME_MARKER,NARRATION,"And for a while, the math checks out.",7,2.0
89,PV_0014,BEAT_03_01,PHASE_CONFLICT,ESTABLISH,NARRATION,"The trading firm makes hundreds of millions in its first year.",10,0
90,PV_0014,BEAT_03_01,PHASE_CONFLICT,ESTABLISH,NARRATION,"Arbitrage.",1,0
91,PV_0014,BEAT_03_01,PHASE_CONFLICT,ESTABLISH,NARRATION,"The cracks in the market.",5,0
92,PV_0014,BEAT_03_01,PHASE_CONFLICT,ESTABLISH,NARRATION,"No one else is fast enough to catch them.",8,0.5
93,PV_0014,BEAT_03_01,PHASE_CONFLICT,ESTABLISH,NARRATION,"You're proving the philosophy right.",5,0
94,PV_0014,BEAT_03_01,PHASE_CONFLICT,ESTABLISH,NARRATION,"Earn to give.",3,0
95,PV_0014,BEAT_03_01,PHASE_CONFLICT,ESTABLISH,NARRATION,"Every dollar is a future life saved.",7,0
96,PV_0014,BEAT_03_01,PHASE_CONFLICT,ESTABLISH,NARRATION,"You donate millions to charity.",5,0
97,PV_0014,BEAT_03_01,PHASE_CONFLICT,ESTABLISH,NARRATION,"You track the impact per dollar on a spreadsheet that nobody else sees.",12,0
98,PV_0014,BEAT_03_01,PHASE_CONFLICT,ESTABLISH,WEIGHT_LINE,"The numbers validate everything you believe.",6,1.5
99,PV_0014,BEAT_03_02,PHASE_CONFLICT,ESTABLISH,TIME_MARKER,"You are twenty-seven.",4,1.0
100,PV_0014,BEAT_03_02,PHASE_CONFLICT,ESTABLISH,NARRATION,"You build your own exchange.",5,0
101,PV_0014,BEAT_03_02,PHASE_CONFLICT,ESTABLISH,NARRATION,"Not on Wall Street.",4,0
102,PV_0014,BEAT_03_02,PHASE_CONFLICT,ESTABLISH,NARRATION,"On an island.",3,0
103,PV_0014,BEAT_03_02,PHASE_CONFLICT,ESTABLISH,NARRATION,"The Caribbean.",2,0.5
104,PV_0014,BEAT_03_02,PHASE_CONFLICT,ESTABLISH,NARRATION,"The penthouse costs forty million dollars.",6,0
105,PV_0014,BEAT_03_02,PHASE_CONFLICT,ESTABLISH,NARRATION,"Ten people live there.",4,0
106,PV_0014,BEAT_03_02,PHASE_CONFLICT,ESTABLISH,NARRATION,"They also work there.",4,0
107,PV_0014,BEAT_03_02,PHASE_CONFLICT,ESTABLISH,NARRATION,"Some of them are dating each other.",6,0
108,PV_0014,BEAT_03_02,PHASE_CONFLICT,ESTABLISH,NARRATION,"You call it optimizing.",4,0
109,PV_0014,BEAT_03_02,PHASE_CONFLICT,ESTABLISH,WEIGHT_LINE,"Not luxury. Optimizing.",3,1.5
110,PV_0014,BEAT_03_02,PHASE_CONFLICT,ESTABLISH,NARRATION,"The air conditioning runs all day.",6,0
111,PV_0014,BEAT_03_02,PHASE_CONFLICT,ESTABLISH,NARRATION,"The screens never turn off.",5,0
112,PV_0014,BEAT_03_02,PHASE_CONFLICT,ESTABLISH,NARRATION,"You sleep on a beanbag sometimes.",6,0
113,PV_0014,BEAT_03_02,PHASE_CONFLICT,ESTABLISH,NARRATION,"You don't remember when that became normal.",7,0.5
114,PV_0014,BEAT_03_03,PHASE_CONFLICT,CONFLICT,NARRATION,"The biggest investors in the world pour money in.",8,0
115,PV_0014,BEAT_03_03,PHASE_CONFLICT,CONFLICT,NARRATION,"Four hundred million.",3,0
116,PV_0014,BEAT_03_03,PHASE_CONFLICT,CONFLICT,NARRATION,"Then two billion.",3,0.5
117,PV_0014,BEAT_03_03,PHASE_CONFLICT,CONFLICT,NARRATION,"They write articles about you.",5,0
118,PV_0014,BEAT_03_03,PHASE_CONFLICT,CONFLICT,NARRATION,"They call you a once-in-a-generation founder.",7,0
119,PV_0014,BEAT_03_03,PHASE_CONFLICT,CONFLICT,NARRATION,"You bookmark the articles.",4,0
120,PV_0014,BEAT_03_03,PHASE_CONFLICT,CONFLICT,NARRATION,"You don't read them twice.",5,0
121,PV_0014,BEAT_03_03,PHASE_CONFLICT,CONFLICT,NARRATION,"Or maybe you do.",4,0.5
122,PV_0014,BEAT_03_03,PHASE_CONFLICT,CONFLICT,NARRATION,"Congress invites you to testify.",5,0
123,PV_0014,BEAT_03_03,PHASE_CONFLICT,CONFLICT,NARRATION,"They call you responsible.",4,0
124,PV_0014,BEAT_03_03,PHASE_CONFLICT,CONFLICT,NARRATION,"They call you the adult in the room.",7,0.5
125,PV_0014,BEAT_03_03,PHASE_CONFLICT,CONFLICT,NARRATION,"You play video games during board calls.",6,0
126,PV_0014,BEAT_03_03,PHASE_CONFLICT,CONFLICT,NARRATION,"Not because you don't care.",5,0
127,PV_0014,BEAT_03_03,PHASE_CONFLICT,CONFLICT,WEIGHT_LINE,"Because you think faster than everyone on the screen.",9,1.5
128,PV_0014,BEAT_03_03,PHASE_CONFLICT,CONFLICT,NARRATION,"Someone shakes your hand after the hearing.",7,0
129,PV_0014,BEAT_03_03,PHASE_CONFLICT,CONFLICT,NARRATION,"They hold it a second too long.",6,0
130,PV_0014,BEAT_03_03,PHASE_CONFLICT,CONFLICT,NARRATION,"You don't know what to do with that.",7,0.5
131,PV_0014,BEAT_03_04,PHASE_CONFLICT,CONFLICT,NARRATION,"You donate a hundred million dollars to political campaigns.",9,0
132,PV_0014,BEAT_03_04,PHASE_CONFLICT,CONFLICT,NARRATION,"Both sides.",2,0
133,PV_0014,BEAT_03_04,PHASE_CONFLICT,CONFLICT,NARRATION,"Maximum impact requires maximum leverage.",5,0
134,PV_0014,BEAT_03_04,PHASE_CONFLICT,CONFLICT,NARRATION,"The philosophy says so.",4,0.5
135,PV_0014,BEAT_03_04,PHASE_CONFLICT,CONFLICT,NARRATION,"Every dollar has a calculation behind it.",6,0
136,PV_0014,BEAT_03_04,PHASE_CONFLICT,CONFLICT,NARRATION,"Every relationship has a purpose.",5,0
137,PV_0014,BEAT_03_04,PHASE_CONFLICT,CONFLICT,NARRATION,"You try to explain it to someone once - the philosophy, the math, why it all connects.",15,0
138,PV_0014,BEAT_03_04,PHASE_CONFLICT,CONFLICT,NARRATION,"It doesn't come out right.",5,0
139,PV_0014,BEAT_03_04,PHASE_CONFLICT,CONFLICT,WEIGHT_LINE,"You stop trying after that.",5,1.5
140,PV_0014,BEAT_03_04,PHASE_CONFLICT,CONFLICT,NARRATION,"You eat the same thing every day.",7,0
141,PV_0014,BEAT_03_04,PHASE_CONFLICT,CONFLICT,NARRATION,"You wear the same shorts.",5,0
142,PV_0014,BEAT_03_04,PHASE_CONFLICT,CONFLICT,NARRATION,"Optimizing decisions means eliminating the ones that don't matter.",9,0
143,PV_0014,BEAT_03_04,PHASE_CONFLICT,CONFLICT,NARRATION,"You tap the edge of the table once.",7,0
144,PV_0014,BEAT_03_04,PHASE_CONFLICT,CONFLICT,NARRATION,"Just once.",2,0
145,PV_0014,BEAT_03_04,PHASE_CONFLICT,CONFLICT,NARRATION,"Then you stop.",3,0.5
146,PV_0014,BEAT_03_05,PHASE_CONFLICT,CONFLICT,NARRATION,"But behind everything, the trading firm is losing money.",9,0
147,PV_0014,BEAT_03_05,PHASE_CONFLICT,CONFLICT,NARRATION,"Big trades.",2,0
148,PV_0014,BEAT_03_05,PHASE_CONFLICT,CONFLICT,NARRATION,"Bad bets.",2,0
149,PV_0014,BEAT_03_05,PHASE_CONFLICT,CONFLICT,NARRATION,"Positions that were supposed to be hedged.",7,0
150,PV_0014,BEAT_03_05,PHASE_CONFLICT,CONFLICT,NARRATION,"They weren't.",2,0.5
151,PV_0014,BEAT_03_05,PHASE_CONFLICT,CONFLICT,NARRATION,"The hole gets deeper.",4,0
152,PV_0014,BEAT_03_05,PHASE_CONFLICT,CONFLICT,NARRATION,"And you fill it.",4,0
153,PV_0014,BEAT_03_05,PHASE_CONFLICT,CONFLICT,NARRATION,"With customer money.",3,0.5
154,PV_0014,BEAT_03_05,PHASE_CONFLICT,CONFLICT,NARRATION,"You don't think of it as stealing.",6,0
155,PV_0014,BEAT_03_05,PHASE_CONFLICT,CONFLICT,NARRATION,"You're borrowing.",2,0
156,PV_0014,BEAT_03_05,PHASE_CONFLICT,CONFLICT,WEIGHT_LINE,"You'll put it back before anyone needs it.",8,1.0
157,PV_0014,BEAT_03_05,PHASE_CONFLICT,CONFLICT,NARRATION,"That's what you tell yourself every morning.",7,0
158,PV_0014,BEAT_03_05,PHASE_CONFLICT,CONFLICT,NARRATION,"Every afternoon.",2,0
159,PV_0014,BEAT_03_05,PHASE_CONFLICT,CONFLICT,NARRATION,"Every night when the screens are still on and everyone else has gone to sleep in the rooms down the hall.",18,0
160,PV_0014,BEAT_03_05,PHASE_CONFLICT,CONFLICT,NARRATION,"The coffee's cold by the time you notice it.",8,0.5
161,PV_0014,BEAT_03_06,PHASE_CONFLICT,REFLECT,NARRATION,"There's a backdoor in the code.",6,0
162,PV_0014,BEAT_03_06,PHASE_CONFLICT,REFLECT,NARRATION,"Your co-founder built it.",4,0
163,PV_0014,BEAT_03_06,PHASE_CONFLICT,REFLECT,NARRATION,"You asked him to.",4,0.5
164,PV_0014,BEAT_03_06,PHASE_CONFLICT,REFLECT,NARRATION,"Eight billion dollars flow from the exchange to the trading firm through a door no one outside the penthouse can see.",19,0.5
165,PV_0014,BEAT_03_06,PHASE_CONFLICT,REFLECT,NARRATION,"They know.",2,0
166,PV_0014,BEAT_03_06,PHASE_CONFLICT,REFLECT,NARRATION,"Your girlfriend knows.",3,0
167,PV_0014,BEAT_03_06,PHASE_CONFLICT,REFLECT,NARRATION,"Your co-founder knows.",3,0
168,PV_0014,BEAT_03_06,PHASE_CONFLICT,REFLECT,NARRATION,"Your best friend knows.",4,0
169,PV_0014,BEAT_03_06,PHASE_CONFLICT,REFLECT,NARRATION,"Nobody says anything.",3,0.5
170,PV_0014,BEAT_03_06,PHASE_CONFLICT,REFLECT,NARRATION,"On paper, it all works.",5,0
171,PV_0014,BEAT_03_06,PHASE_CONFLICT,REFLECT,NARRATION,"You keep looking at the paper.",6,0.5
172,PV_0014,BEAT_03_06,PHASE_CONFLICT,REFLECT,NARRATION,"You don't think you're the villain.",6,0
173,PV_0014,BEAT_03_06,PHASE_CONFLICT,REFLECT,WEIGHT_LINE,"You think you're the only one smart enough to fix the system.",11,1.5
174,PV_0014,BEAT_03_06,PHASE_CONFLICT,REFLECT,NARRATION,"Your shoulders are up near your ears.",6,0
175,PV_0014,BEAT_03_06,PHASE_CONFLICT,REFLECT,NARRATION,"You lower them.",3,0
176,PV_0014,BEAT_03_06,PHASE_CONFLICT,REFLECT,NARRATION,"They go back up.",4,0.5
177,PV_0014,BEAT_03_07,PHASE_CONFLICT,CONSTRAINT,NARRATION,"The hole gets bigger every week.",6,0
178,PV_0014,BEAT_03_07,PHASE_CONFLICT,CONSTRAINT,NARRATION,"You know this.",3,0
179,PV_0014,BEAT_03_07,PHASE_CONFLICT,CONSTRAINT,NARRATION,"You've run the numbers.",4,0.5
180,PV_0014,BEAT_03_07,PHASE_CONFLICT,CONSTRAINT,NARRATION,"But you can't stop.",4,0
181,PV_0014,BEAT_03_07,PHASE_CONFLICT,CONSTRAINT,NARRATION,"Because stopping means telling people.",5,0
182,PV_0014,BEAT_03_07,PHASE_CONFLICT,CONSTRAINT,NARRATION,"And telling people means admitting you were wrong from the beginning.",9,0
183,PV_0014,BEAT_03_07,PHASE_CONFLICT,CONSTRAINT,WEIGHT_LINE,"And that is the one thing you cannot do.",9,1.0
184,PV_0014,BEAT_03_07,PHASE_CONFLICT,CONSTRAINT,NARRATION,"You think you understand how this ends.",7,0
185,PV_0014,BEAT_03_07,PHASE_CONFLICT,CONSTRAINT,WEIGHT_LINE,"You don't.",2,2.0
186,PV_0014,BEAT_04_01,PHASE_CRISIS,CRISIS,NARRATION,"One post.",2,0
187,PV_0014,BEAT_04_01,PHASE_CRISIS,CRISIS,WEIGHT_LINE,"That's all it takes.",4,0.5
188,PV_0014,BEAT_04_01,PHASE_CRISIS,CRISIS,NARRATION,"The competitor publishes your balance sheet.",6,0
189,PV_0014,BEAT_04_01,PHASE_CRISIS,CRISIS,NARRATION,"The number that was never supposed to be public.",8,0
190,PV_0014,BEAT_04_01,PHASE_CRISIS,CRISIS,NARRATION,"The screen's too bright.",4,0
191,PV_0014,BEAT_04_01,PHASE_CRISIS,CRISIS,NARRATION,"You can feel your pulse in your wrists.",7,0.5
192,PV_0014,BEAT_04_01,PHASE_CRISIS,CRISIS,WEIGHT_LINE,"Seventy-two hours.",2,1.5
193,PV_0014,BEAT_04_02,PHASE_CRISIS,CRISIS,NARRATION,"Six billion in withdrawals.",4,0
194,PV_0014,BEAT_04_02,PHASE_CRISIS,CRISIS,NARRATION,"Three days.",2,0
195,PV_0014,BEAT_04_02,PHASE_CRISIS,CRISIS,NARRATION,"The money isn't there.",4,0
196,PV_0014,BEAT_04_02,PHASE_CRISIS,CRISIS,NARRATION,"It hasn't been there for months.",6,0.5
197,PV_0014,BEAT_04_02,PHASE_CRISIS,CRISIS,NARRATION,"You sit in the penthouse.",5,0
198,PV_0014,BEAT_04_02,PHASE_CRISIS,CRISIS,NARRATION,"Staring at screens.",3,0
199,PV_0014,BEAT_04_02,PHASE_CRISIS,CRISIS,NARRATION,"Everyone else in the room is silent.",6,0
200,PV_0014,BEAT_04_02,PHASE_CRISIS,CRISIS,NARRATION,"Nobody's playing games anymore.",4,0.5
201,PV_0014,BEAT_04_02,PHASE_CRISIS,CRISIS,NARRATION,"Something happens in your chest.",5,0
202,PV_0014,BEAT_04_02,PHASE_CRISIS,CRISIS,NARRATION,"Not pain.",2,0
203,PV_0014,BEAT_04_02,PHASE_CRISIS,CRISIS,NARRATION,"Not panic.",2,0
204,PV_0014,BEAT_04_02,PHASE_CRISIS,CRISIS,NARRATION,"Just a skip.",3,0
205,PV_0014,BEAT_04_02,PHASE_CRISIS,CRISIS,NARRATION,"And then it's gone.",4,0.5
206,PV_0014,BEAT_04_02,PHASE_CRISIS,CRISIS,NARRATION,"You still think if you had twenty-four more hours you could fix it.",12,0.5
207,PV_0014,BEAT_04_02,PHASE_CRISIS,CRISIS,WEIGHT_LINE,"You can't.",2,1.5
208,PV_0014,BEAT_04_03,PHASE_CRISIS,CRISIS,NARRATION,"You call the competitor.",4,0
209,PV_0014,BEAT_04_03,PHASE_CRISIS,CRISIS,NARRATION,"The one who exposed you.",5,0
210,PV_0014,BEAT_04_03,PHASE_CRISIS,CRISIS,NARRATION,"There's a deal on the table.",6,0
211,PV_0014,BEAT_04_03,PHASE_CRISIS,CRISIS,NARRATION,"A merger.",2,0
212,PV_0014,BEAT_04_03,PHASE_CRISIS,CRISIS,NARRATION,"Salvation.",1,0.5
213,PV_0014,BEAT_04_03,PHASE_CRISIS,CRISIS,NARRATION,"For eight hours it looks like it might work.",8,0
214,PV_0014,BEAT_04_03,PHASE_CRISIS,CRISIS,NARRATION,"His team looks at your books.",6,0
215,PV_0014,BEAT_04_03,PHASE_CRISIS,CRISIS,NARRATION,"They see the hole.",4,0.5
216,PV_0014,BEAT_04_03,PHASE_CRISIS,CRISIS,NARRATION,"Then he walks away.",4,0
217,PV_0014,BEAT_04_03,PHASE_CRISIS,CRISIS,WEIGHT_LINE,"The only person who could save you chooses to watch you sink.",11,1.5
218,PV_0014,BEAT_04_04,PHASE_CRISIS,CRISIS,NARRATION,"The exchange shuts down.",4,0
219,PV_0014,BEAT_04_04,PHASE_CRISIS,CRISIS,NARRATION,"Eight billion dollars.",3,0
220,PV_0014,BEAT_04_04,PHASE_CRISIS,CRISIS,NARRATION,"Gone.",1,0
221,PV_0014,BEAT_04_44,PHASE_CRISIS,CRISIS,NARRATION,"Eight million people.",3,0.5
222,PV_0014,BEAT_04_04,PHASE_CRISIS,CRISIS,NARRATION,"Your phone still says 'assets are fine.'",6,0
223,PV_0014,BEAT_04_04,PHASE_CRISIS,CRISIS,NARRATION,"You're still tweeting it when the police knock.",8,0
224,PV_0014,BEAT_04_04,PHASE_CRISIS,CRISIS,NARRATION,"You open the door in cargo shorts.",6,0.5
225,PV_0014,BEAT_04_04,PHASE_CRISIS,CRISIS,NARRATION,"That's it.",2,2.0
226,PV_0014,BEAT_04_05,PHASE_CRISIS,REFLECT,NARRATION,"They bring you to New York.",5,0
227,PV_0014,BEAT_04_05,PHASE_CRISIS,REFLECT,NARRATION,"Federal court.",2,0.5
228,PV_0014,BEAT_04_05,PHASE_CRISIS,REFLECT,NARRATION,"Your co-founder takes the stand.",5,0
229,PV_0014,BEAT_04_05,PHASE_CRISIS,REFLECT,NARRATION,"Your engineer takes the stand.",5,0
230,PV_0014,BEAT_04_05,PHASE_CRISIS,REFLECT,NARRATION,"Your best friend takes the stand.",6,0.5
231,PV_0014,BEAT_04_05,PHASE_CRISIS,REFLECT,NARRATION,"One by one.",3,0
232,PV_0014,BEAT_04_05,PHASE_CRISIS,REFLECT,NARRATION,"The same people who lived in the penthouse.",7,0
233,PV_0014,BEAT_04_05,PHASE_CRISIS,REFLECT,NARRATION,"Who ate dinner with you.",5,0
234,PV_0014,BEAT_04_05,PHASE_CRISIS,REFLECT,NARRATION,"Who said they believed in the mission.",7,0.5
235,PV_0014,BEAT_04_05,PHASE_CRISIS,REFLECT,NARRATION,"And then she takes the stand.",6,0
236,PV_0014,BEAT_04_05,PHASE_CRISIS,REFLECT,NARRATION,"The one who ran the trading firm.",6,0
237,PV_0014,BEAT_04_05,PHASE_CRISIS,REFLECT,NARRATION,"The one you trusted most.",5,0.5
238,PV_0014,BEAT_04_05,PHASE_CRISIS,REFLECT,NARRATION,"She tells them everything.",4,0
239,PV_0014,BEAT_04_05,PHASE_CRISIS,REFLECT,NARRATION,"Every number.",2,0
240,PV_0014,BEAT_04_05,PHASE_CRISIS,REFLECT,WEIGHT_LINE,"Every lie.",2,2.0
241,PV_0014,BEAT_05_01,PHASE_RESOLUTION,REFLECT,NARRATION,"The trial lasts four weeks.",5,0
242,PV_0014,BEAT_05_01,PHASE_RESOLUTION,REFLECT,NARRATION,"Every day you sit in a suit you didn't choose.",9,0
243,PV_0014,BEAT_05_01,PHASE_RESOLUTION,REFLECT,NARRATION,"First piece of clothing in your life someone else picked.",9,0.5
244,PV_0014,BEAT_05_01,PHASE_RESOLUTION,REFLECT,NARRATION,"Your hair is short now.",5,0
245,PV_0014,BEAT_05_01,PHASE_RESOLUTION,REFLECT,NARRATION,"A barber in the jail did it.",6,0
246,PV_0014,BEAT_05_01,PHASE_RESOLUTION,REFLECT,NARRATION,"You didn't ask for a mirror.",6,0.5
247,PV_0014,BEAT_05_01,PHASE_RESOLUTION,REFLECT,NARRATION,"You listen to people describe you.",6,0
248,PV_0014,BEAT_05_01,PHASE_RESOLUTION,REFLECT,NARRATION,"They use words you don't recognize.",6,0
249,PV_0014,BEAT_05_01,PHASE_RESOLUTION,REFLECT,NARRATION,"Fraud.",1,0
250,PV_0014,BEAT_05_01,PHASE_RESOLUTION,REFLECT,NARRATION,"Conspiracy.",1,0
251,PV_0014,BEAT_05_01,PHASE_RESOLUTION,REFLECT,NARRATION,"Wire theft.",2,0.5
252,PV_0014,BEAT_05_01,PHASE_RESOLUTION,REFLECT,NARRATION,"You look at your hands.",5,0
253,PV_0014,BEAT_05_01,PHASE_RESOLUTION,REFLECT,NARRATION,"They look the same.",4,0
254,PV_0014,BEAT_05_01,PHASE_RESOLUTION,REFLECT,WEIGHT_LINE,"But nothing else does.",4,1.5
255,PV_0014,BEAT_05_02,PHASE_RESOLUTION,REFLECT,NARRATION,"Your parents sit in the front row.",6,0
256,PV_0014,BEAT_05_02,PHASE_RESOLUTION,REFLECT,NARRATION,"Every day.",2,0.5
257,PV_0014,BEAT_05_02,PHASE_RESOLUTION,REFLECT,NARRATION,"Two professors who taught you how to think.",7,0
258,PV_0014,BEAT_05_02,PHASE_RESOLUTION,REFLECT,NARRATION,"Who taught you about systems and consequences.",6,0
259,PV_0014,BEAT_05_02,PHASE_RESOLUTION,REFLECT,NARRATION,"Now they watch the prosecution read your own words back to you - every speech about saving the world, every interview about giving it all away.",24,0.5
260,PV_0014,BEAT_05_02,PHASE_RESOLUTION,REFLECT,WEIGHT_LINE,"Used as evidence that you knew exactly what you were doing.",10,1.5
261,PV_0014,BEAT_05_02,PHASE_RESOLUTION,REFLECT,NARRATION,"Your mother stares straight ahead.",5,0
262,PV_0014,BEAT_05_02,PHASE_RESOLUTION,REFLECT,NARRATION,"Your father takes notes.",4,0
263,PV_0014,BEAT_05_02,PHASE_RESOLUTION,REFLECT,NARRATION,"You try to remember what you said at the last dinner you had together - the one before everything collapsed.",18,0
264,PV_0014,BEAT_05_02,PHASE_RESOLUTION,REFLECT,NARRATION,"You can't.",2,0
265,PV_0014,BEAT_05_02,PHASE_RESOLUTION,REFLECT,NARRATION,"You don't look at them.",5,0
266,PV_0014,BEAT_05_02,PHASE_RESOLUTION,REFLECT,NARRATION,"Not once.",2,1.0
267,PV_0014,BEAT_05_03,PHASE_RESOLUTION,RESOLVE,NARRATION,"Guilty.",1,0.5
268,PV_0014,BEAT_05_03,PHASE_RESOLUTION,RESOLVE,NARRATION,"Seven counts.",2,0
269,PV_0014,BEAT_05_03,PHASE_RESOLUTION,RESOLVE,NARRATION,"The judge says twenty-five years.",5,1.0
270,PV_0014,BEAT_05_03,PHASE_RESOLUTION,RESOLVE,NARRATION,"Everyone trusted you.",3,0
271,PV_0014,BEAT_05_03,PHASE_RESOLUTION,RESOLVE,WEIGHT_LINE,"Everyone was wrong.",3,1.5
272,PV_0014,BEAT_05_03,PHASE_RESOLUTION,RESOLVE,NARRATION,"You spent your entire life becoming the person who could save the world.",12,0
273,PV_0014,BEAT_05_03,PHASE_RESOLUTION,RESOLVE,WEIGHT_LINE,"Now you're just a defendant number.",6,1.5
274,PV_0014,BEAT_05_04,PHASE_RESOLUTION,RESOLVE,NARRATION,"The cell has no screen.",5,0
