VO_ID,Episode_ID,Beat_ID,Life_Phase,Beat_Type,VO_Type,VO_EN,Word_Count_EN,Pause_After
1,PV_0013,BEAT_01_01,HOOK,ESTABLISH,NARRATION,The news calls it digital gold.,6,0.5
2,PV_0013,BEAT_01_01,HOOK,ESTABLISH,NARRATION,You're sitting in a cafe somewhere.,6,0
3,PV_0013,BEAT_01_01,HOOK,ESTABLISH,NARRATION,Your laptop is open.,4,0
4,PV_0013,BEAT_01_01,HOOK,ESTABLISH,NARRATION,The price is on the screen.,6,0.5
5,PV_0013,BEAT_01_01,HOOK,ESTABLISH,NARRATION,Somebody behind the counter is talking about blockchain.,9,0
6,PV_0013,BEAT_01_01,HOOK,ESTABLISH,NARRATION,They're using the word like it's brand new.,8,0
7,PV_0013,BEAT_01_01,HOOK,ESTABLISH,NARRATION,You remember writing it.,4,0.5
8,PV_0013,BEAT_01_01,HOOK,ESTABLISH,NARRATION,You know who built this.,5,0
9,PV_0013,BEAT_01_01,HOOK,ESTABLISH,NARRATION,You know exactly who.,4,0.5
10,PV_0013,BEAT_01_01,HOOK,ESTABLISH,WEIGHT_LINE,You can't say a word.,5,1.0
11,PV_0013,BEAT_01_02,HOOK,PRIVILEGE,NARRATION,One million coins sitting in a wallet.,7,0
12,PV_0013,BEAT_01_02,HOOK,PRIVILEGE,WEIGHT_LINE,Untouched.,1,1.0
13,PV_0013,BEAT_01_02,HOOK,PRIVILEGE,NARRATION,Worth tens of billions now.,5,0.5
14,PV_0013,BEAT_01_02,HOOK,PRIVILEGE,NARRATION,The largest fortune no one has ever moved.,8,0.5
15,PV_0013,BEAT_01_02,HOOK,PRIVILEGE,NARRATION,No bank holds it.,4,0
16,PV_0013,BEAT_01_02,HOOK,PRIVILEGE,NARRATION,No government controls it.,4,0
17,PV_0013,BEAT_01_02,HOOK,PRIVILEGE,NARRATION,It just sits there in the blockchain waiting for someone who will never come back.,15,0.5
18,PV_0013,BEAT_01_02,HOOK,PRIVILEGE,NARRATION,Because the person who owns it doesn't exist.,8,1.5
19,PV_0013,BEAT_01_03,HOOK,ESTABLISH,WEIGHT_LINE,You created digital gold.,4,0.5
20,PV_0013,BEAT_01_03,HOOK,ESTABLISH,WEIGHT_LINE,Then you stood up and walked away.,7,2.0
21,PV_0013,BEAT_02_01,PHASE_EARLY,TIME_MARKER,TIME_MARKER,It starts in 2007.,4,1.0
22,PV_0013,BEAT_02_01,PHASE_EARLY,TIME_MARKER,NARRATION,Late nights.,2,0
23,PV_0013,BEAT_02_01,PHASE_EARLY,TIME_MARKER,NARRATION,A desk.,2,0
24,PV_0013,BEAT_02_01,PHASE_EARLY,TIME_MARKER,NARRATION,A screen.,2,0.5
25,PV_0013,BEAT_02_01,PHASE_EARLY,TIME_MARKER,NARRATION,The room smells like old coffee and warm plastic from the monitor.,12,0
26,PV_0013,BEAT_02_01,PHASE_EARLY,TIME_MARKER,NARRATION,Nobody asked you to fix money.,6,0
27,PV_0013,BEAT_02_01,PHASE_EARLY,TIME_MARKER,NARRATION,Nobody asked you to redesign how trust works between strangers on the internet.,13,0.5
28,PV_0013,BEAT_02_01,PHASE_EARLY,TIME_MARKER,NARRATION,But the problem keeps you up at night.,7,0.5
29,PV_0013,BEAT_02_01,PHASE_EARLY,TIME_MARKER,NARRATION,Every transaction in the world needs a middleman.,8,0
30,PV_0013,BEAT_02_01,PHASE_EARLY,TIME_MARKER,NARRATION,A bank.,2,0
31,PV_0013,BEAT_02_01,PHASE_EARLY,TIME_MARKER,NARRATION,A processor.,2,0
32,PV_0013,BEAT_02_01,PHASE_EARLY,TIME_MARKER,NARRATION,A company that charges you for the privilege of holding your own money.,13,0
33,PV_0013,BEAT_02_01,PHASE_EARLY,TIME_MARKER,NARRATION,You want to remove that someone.,6,0.5
34,PV_0013,BEAT_02_01,PHASE_EARLY,TIME_MARKER,NARRATION,You want to build a system where the math does the trusting.,11,1.0
35,PV_0013,BEAT_02_02,PHASE_EARLY,REFLECT,NARRATION,You write code the way some people pray.,8,0
36,PV_0013,BEAT_02_02,PHASE_EARLY,REFLECT,NARRATION,Alone.,1,0
37,PV_0013,BEAT_02_02,PHASE_EARLY,REFLECT,NARRATION,Late.,1,0
38,PV_0013,BEAT_02_02,PHASE_EARLY,REFLECT,NARRATION,Believing in something no one else can see yet.,9,1.0
39,PV_0013,BEAT_02_02,PHASE_EARLY,REFLECT,NARRATION,You don't eat dinner most nights.,6,0
40,PV_0013,BEAT_02_02,PHASE_EARLY,REFLECT,NARRATION,You just keep going until the screen starts to blur.,10,0.5
41,PV_0013,BEAT_02_02,PHASE_EARLY,REFLECT,NARRATION,If you fail nothing happens.,5,0
42,PV_0013,BEAT_02_02,PHASE_EARLY,REFLECT,NARRATION,Nobody knows your name.,4,0
43,PV_0013,BEAT_02_22,PHASE_EARLY,REFLECT,NARRATION,Nobody knows you tried.,4,0.5
44,PV_0013,BEAT_02_02,PHASE_EARLY,REFLECT,NARRATION,If you succeed everything changes.,5,0
45,PV_0013,BEAT_02_02,PHASE_EARLY,REFLECT,WEIGHT_LINE,And you still won't have a name.,7,1.5
46,PV_0013,BEAT_02_03,PHASE_EARLY,ESTABLISH,NARRATION,"October 31st, 2008.",3,0.5
47,PV_0013,BEAT_02_03,PHASE_EARLY,ESTABLISH,NARRATION,Halloween.,1,0.5
48,PV_0013,BEAT_02_03,PHASE_EARLY,ESTABLISH,NARRATION,You finish the whitepaper.,4,0
49,PV_0013,BEAT_02_03,PHASE_EARLY,ESTABLISH,NARRATION,Nine pages.,2,0
50,PV_0013,BEAT_02_03,PHASE_EARLY,ESTABLISH,NARRATION,"You title it: Bitcoin - A Peer-to-Peer Electronic Cash System.",10,0.5
51,PV_0013,BEAT_02_03,PHASE_EARLY,ESTABLISH,NARRATION,You read it one more time before sending.,8,0
52,PV_0013,BEAT_02_03,PHASE_EARLY,ESTABLISH,NARRATION,Your hands are shaking slightly.,5,0
53,PV_0013,BEAT_02_03,PHASE_EARLY,ESTABLISH,NARRATION,Not from fear.,3,0
54,PV_0013,BEAT_02_03,PHASE_EARLY,ESTABLISH,NARRATION,From something closer to belief.,5,0.5
55,PV_0013,BEAT_02_03,PHASE_EARLY,ESTABLISH,NARRATION,You send it to a cryptography mailing list.,8,0
56,PV_0013,BEAT_02_03,PHASE_EARLY,ESTABLISH,NARRATION,A few dozen people read it.,6,0
57,PV_0013,BEAT_02_03,PHASE_EARLY,ESTABLISH,NARRATION,Most say nothing.,3,0
58,PV_0013,BEAT_02_03,PHASE_EARLY,ESTABLISH,NARRATION,One replies saying it won't scale.,6,0
59,PV_0013,BEAT_02_03,PHASE_EARLY,ESTABLISH,NARRATION,Another calls it interesting but impractical.,6,0.5
60,PV_0013,BEAT_02_03,PHASE_EARLY,ESTABLISH,NARRATION,You don't argue.,3,0
61,PV_0013,BEAT_02_03,PHASE_EARLY,ESTABLISH,NARRATION,You just keep writing code.,5,1.0
62,PV_0013,BEAT_02_04,PHASE_EARLY,ESTABLISH,NARRATION,You register bitcoin.org.,3,0
63,PV_0013,BEAT_02_04,PHASE_EARLY,ESTABLISH,NARRATION,Fake name.,2,0
64,PV_0013,BEAT_02_04,PHASE_EARLY,ESTABLISH,NARRATION,Fake address.,2,0.5
65,PV_0013,BEAT_02_04,PHASE_EARLY,ESTABLISH,WEIGHT_LINE,Only the code is real.,5,1.0
66,PV_0013,BEAT_02_04,PHASE_EARLY,ESTABLISH,NARRATION,You create a profile on the P2P Foundation.,8,0
67,PV_0013,BEAT_02_04,PHASE_EARLY,ESTABLISH,NARRATION,"Birthday: April 5th, 1975.",4,0.5
68,PV_0013,BEAT_02_04,PHASE_EARLY,ESTABLISH,NARRATION,Not your real birthday.,4,0
69,PV_0013,BEAT_02_04,PHASE_EARLY,ESTABLISH,NARRATION,"April 5th, 1933 was the day the US government banned citizens from owning gold.",14,0
70,PV_0013,BEAT_02_04,PHASE_EARLY,ESTABLISH,NARRATION,1975 was the year they gave it back.,7,0.5
71,PV_0013,BEAT_02_04,PHASE_EARLY,ESTABLISH,NARRATION,You chose a birthday that is a protest.,7,0
72,PV_0013,BEAT_02_04,PHASE_EARLY,ESTABLISH,NARRATION,Nobody notices.,2,1.0
73,PV_0013,BEAT_02_05,PHASE_EARLY,REFLECT,NARRATION,You have no team.,4,0
74,PV_0013,BEAT_02_05,PHASE_EARLY,REFLECT,NARRATION,No funding.,2,0
75,PV_0013,BEAT_02_05,PHASE_EARLY,REFLECT,NARRATION,No advisor.,2,0
76,PV_0013,BEAT_02_05,PHASE_EARLY,REFLECT,NARRATION,No one to tell when the code compiles at 3 AM.,10,0.5
77,PV_0013,BEAT_02_05,PHASE_EARLY,REFLECT,NARRATION,You push back from the desk sometimes and just sit there.,10,0
78,PV_0013,BEAT_02_05,PHASE_EARLY,REFLECT,NARRATION,Listening to the hard drive spin.,6,0
79,PV_0013,BEAT_02_05,PHASE_EARLY,REFLECT,NARRATION,You wonder sometimes if you're wasting your life on a thing no one will ever use.,15,0.5
80,PV_0013,BEAT_02_05,PHASE_EARLY,REFLECT,NARRATION,Then you open the laptop and keep going.,8,0.5
81,PV_0013,BEAT_02_05,PHASE_EARLY,REFLECT,NARRATION,You live alone with this.,5,0
82,PV_0013,BEAT_02_05,PHASE_EARLY,REFLECT,NARRATION,Not because you have to.,5,0
83,PV_0013,BEAT_02_05,PHASE_EARLY,REFLECT,WEIGHT_LINE,Because what you're building must never have an owner.,9,2.0
84,PV_0013,BEAT_03_01,PHASE_CONFLICT,ESTABLISH,NARRATION,"January 3rd, 2009.",3,1.0
85,PV_0013,BEAT_03_01,PHASE_CONFLICT,ESTABLISH,NARRATION,You press enter.,3,0.5
86,PV_0013,BEAT_03_01,PHASE_CONFLICT,ESTABLISH,NARRATION,The first block is mined.,5,0
87,PV_0013,BEAT_03_01,PHASE_CONFLICT,ESTABLISH,NARRATION,Block zero.,2,0
88,PV_0013,BEAT_03_01,PHASE_CONFLICT,ESTABLISH,NARRATION,The genesis block.,3,0.5
89,PV_0013,BEAT_03_01,PHASE_CONFLICT,ESTABLISH,NARRATION,You embed a headline from that morning's Times of London.,10,0
90,PV_0013,BEAT_03_01,PHASE_CONFLICT,ESTABLISH,NARRATION,Chancellor on brink of second bailout for banks.,8,0.5
91,PV_0013,BEAT_03_01,PHASE_CONFLICT,ESTABLISH,NARRATION,It's not there for decoration.,5,0
92,PV_0013,BEAT_03_01,PHASE_CONFLICT,ESTABLISH,NARRATION,It's a timestamp.,3,0
93,PV_0013,BEAT_03_01,PHASE_CONFLICT,ESTABLISH,WEIGHT_LINE,And a reason.,3,1.5
94,PV_0013,BEAT_03_02,PHASE_CONFLICT,ESTABLISH,NARRATION,Nine days later.,3,0.5
95,PV_0013,BEAT_03_02,PHASE_CONFLICT,ESTABLISH,NARRATION,You send ten coins to a man named Hal Finney.,10,0
96,PV_0013,BEAT_03_02,PHASE_CONFLICT,ESTABLISH,NARRATION,He's a cryptographer.,3,0
97,PV_0013,BEAT_03_02,PHASE_CONFLICT,ESTABLISH,NARRATION,He downloaded the software the day it launched.,8,0
98,PV_0013,BEAT_03_02,PHASE_CONFLICT,ESTABLISH,NARRATION,He didn't even ask what it was worth.,8,0
99,PV_0013,BEAT_03_02,PHASE_CONFLICT,ESTABLISH,NARRATION,He just wanted to see if it worked.,8,0.5
100,PV_0013,BEAT_03_02,PHASE_CONFLICT,ESTABLISH,NARRATION,He's the first person on Earth who believed this could work.,11,0.5
101,PV_0013,BEAT_03_02,PHASE_CONFLICT,ESTABLISH,NARRATION,Ten coins.,2,0
102,PV_0013,BEAT_03_02,PHASE_CONFLICT,ESTABLISH,NARRATION,Worth exactly nothing.,3,1.0
103,PV_0013,BEAT_03_03,PHASE_CONFLICT,REFLECT,NARRATION,"Slowly, people start using it.",5,0.5
104,PV_0013,BEAT_03_03,PHASE_CONFLICT,REFLECT,NARRATION,Not because they trust you.,5,0
105,PV_0013,BEAT_03_03,PHASE_CONFLICT,REFLECT,NARRATION,They don't even know you.,5,0
106,PV_0013,BEAT_03_03,PHASE_CONFLICT,REFLECT,NARRATION,They trust the math.,4,0
107,PV_0013,BEAT_03_03,PHASE_CONFLICT,REFLECT,NARRATION,They trust the code.,4,0.5
108,PV_0013,BEAT_03_03,PHASE_CONFLICT,REFLECT,NARRATION,A few hundred users become a few thousand.,8,0
109,PV_0013,BEAT_03_03,PHASE_CONFLICT,REFLECT,NARRATION,Then ten thousand.,3,0
110,PV_0013,BEAT_03_33,PHASE_CONFLICT,REFLECT,NARRATION,You watch the network grow from your screen like watching something breathe for the first time.,15,0.5
111,PV_0013,BEAT_03_03,PHASE_CONFLICT,REFLECT,NARRATION,That's exactly what you wanted.,5,0
112,PV_0013,BEAT_03_03,PHASE_CONFLICT,REFLECT,WEIGHT_LINE,And that's exactly what will erase you.,7,1.5
113,PV_0013,BEAT_03_04,PHASE_CONFLICT,PRIVILEGE,NARRATION,"May 22nd, 2010.",3,0.5
114,PV_0013,BEAT_03_04,PHASE_CONFLICT,PRIVILEGE,NARRATION,A programmer in Florida buys two pizzas for ten thousand coins.,11,0
115,PV_0013,BEAT_03_04,PHASE_CONFLICT,PRIVILEGE,NARRATION,Ten thousand coins.,3,0
116,PV_0013,BEAT_03_04,PHASE_CONFLICT,PRIVILEGE,NARRATION,Two pizzas.,2,0.5
117,PV_0013,BEAT_03_04,PHASE_CONFLICT,PRIVILEGE,NARRATION,Nobody laughs.,2,0
118,PV_0013,BEAT_03_04,PHASE_CONFLICT,PRIVILEGE,NARRATION,Because nobody realizes what they're holding.,6,0.5
119,PV_0013,BEAT_03_04,PHASE_CONFLICT,PRIVILEGE,NARRATION,You do.,2,1.0
120,PV_0013,BEAT_03_05,PHASE_CONFLICT,CONSTRAINT,NARRATION,Then WikiLeaks starts accepting it.,5,0.5
121,PV_0013,BEAT_03_05,PHASE_CONFLICT,CONSTRAINT,NARRATION,The attention is enormous.,4,0
122,PV_0013,BEAT_03_05,PHASE_CONFLICT,CONSTRAINT,NARRATION,Governments are watching now.,4,0
123,PV_0013,BEAT_03_05,PHASE_CONFLICT,CONSTRAINT,NARRATION,Intelligence agencies are reading the forums.,6,0.5
124,PV_0013,BEAT_03_05,PHASE_CONFLICT,CONSTRAINT,NARRATION,You post a warning.,4,0
125,PV_0013,BEAT_03_05,PHASE_CONFLICT,CONSTRAINT,NARRATION,You've kicked a hornet's nest.,5,0
126,PV_0013,BEAT_03_05,PHASE_CONFLICT,CONSTRAINT,NARRATION,Too soon.,2,0
127,PV_0013,BEAT_03_05,PHASE_CONFLICT,CONSTRAINT,NARRATION,Too fast.,2,0.5
128,PV_0013,BEAT_03_05,PHASE_CONFLICT,CONSTRAINT,NARRATION,You didn't build this to become a headline.,8,0
129,PV_0013,BEAT_03_05,PHASE_CONFLICT,CONSTRAINT,NARRATION,You built it to become invisible.,6,0
130,PV_0013,BEAT_03_05,PHASE_CONFLICT,CONSTRAINT,NARRATION,But you can't control what people do with something you gave away for free.,13,1.0
131,PV_0013,BEAT_03_06,PHASE_CONFLICT,REFLECT,NARRATION,And here's the thing you understand now.,7,0.5
132,PV_0013,BEAT_03_06,PHASE_CONFLICT,REFLECT,NARRATION,"If you stay, you're the center.",6,0
133,PV_0013,BEAT_03_06,PHASE_CONFLICT,REFLECT,NARRATION,"If you're the center, it isn't decentralized.",7,0
134,PV_0013,BEAT_03_06,PHASE_CONFLICT,REFLECT,NARRATION,"If it isn't decentralized, it's just another system with a name at the top.",13,0.5
135,PV_0013,BEAT_03_06,PHASE_CONFLICT,REFLECT,NARRATION,You stare at the screen for a long time.,8,0.5
136,PV_0013,BEAT_03_06,PHASE_CONFLICT,REFLECT,NARRATION,The cursor blinks.,3,0
137,PV_0013,BEAT_03_06,PHASE_CONFLICT,REFLECT,NARRATION,You crack your knuckles without thinking.,6,0
138,PV_0013,BEAT_03_06,PHASE_CONFLICT,REFLECT,WEIGHT_LINE,The only way your invention survives is if you don't.,10,2.0
139,PV_0013,BEAT_04_01,PHASE_CRISIS,CRISIS,NARRATION,You start handing things over.,5,0.5
140,PV_0013,BEAT_04_01,PHASE_CRISIS,CRISIS,NARRATION,The source code.,3,0
141,PV_0013,BEAT_04_01,PHASE_CRISIS,CRISIS,NARRATION,The network alert key.,4,0
142,PV_0013,BEAT_04_01,PHASE_CRISIS,CRISIS,NARRATION,The domain.,2,0.5
143,PV_0013,BEAT_04_01,PHASE_CRISIS,CRISIS,NARRATION,You give them to a developer named Gavin Andresen.,9,0
144,PV_0013,BEAT_04_01,PHASE_CRISIS,CRISIS,NARRATION,He's the closest thing this project has to a successor.,10,0.5
145,PV_0013,BEAT_04_01,PHASE_CRISIS,CRISIS,NARRATION,He doesn't know it yet.,5,0
146,PV_0013,BEAT_04_01,PHASE_CRISIS,CRISIS,NARRATION,You don't tell him why.,5,1.0
147,PV_0013,BEAT_04_02,PHASE_CRISIS,CRISIS,NARRATION,"April 23rd, 2011.",3,0.5
148,PV_0013,BEAT_04_02,PHASE_CRISIS,CRISIS,NARRATION,You email a developer named Mike Hearn.,7,0
149,PV_0013,BEAT_04_02,PHASE_CRISIS,CRISIS,NARRATION,You write: I've moved on to other things.,8,0
150,PV_0013,BEAT_04_02,PHASE_CRISIS,CRISIS,WEIGHT_LINE,It's in good hands.,4,1.0
151,PV_0013,BEAT_04_02,PHASE_CRISIS,CRISIS,NARRATION,"Three days later, you email Gavin.",6,0
152,PV_0013,BEAT_04_02,PHASE_CRISIS,CRISIS,NARRATION,Your last message.,3,0
153,PV_0013,BEAT_04_02,PHASE_CRISIS,CRISIS,NARRATION,Ever.,1,0.5
154,PV_0013,BEAT_04_02,PHASE_CRISIS,CRISIS,NARRATION,"You write: I wish you wouldn't keep talking about me as a mysterious, shadowy figure.",15,0
155,PV_0013,BEAT_04_02,PHASE_CRISIS,CRISIS,NARRATION,Give more credit to the open source contributors.,8,0
156,PV_0013,BEAT_04_02,PHASE_CRISIS,CRISIS,NARRATION,It helps motivate them.,4,1.0
157,PV_0013,BEAT_04_03,PHASE_CRISIS,CRISIS,NARRATION,The next day.,3,0.5
158,PV_0013,BEAT_04_03,PHASE_CRISIS,CRISIS,NARRATION,April 27th.,2,0
159,PV_0013,BEAT_04_03,PHASE_CRISIS,CRISIS,NARRATION,Gavin posts on the forum.,5,0
160,PV_0013,BEAT_04_03,PHASE_CRISIS,CRISIS,NARRATION,He announces he's been invited to present Bitcoin at the CIA.,11,0.5
161,PV_0013,BEAT_04_03,PHASE_CRISIS,CRISIS,NARRATION,The CIA.,2,0.5
162,PV_0013,BEAT_04_03,PHASE_CRISIS,CRISIS,NARRATION,You read that line.,4,0.5
163,PV_0013,BEAT_04_03,PHASE_CRISIS,CRISIS,NARRATION,You read it again.,4,1.0
164,PV_0013,BEAT_04_04,PHASE_CRISIS,REFLECT,NARRATION,You don't panic.,3,0
165,PV_0013,BEAT_04_04,PHASE_CRISIS,REFLECT,NARRATION,You don't run.,3,0
166,PV_0013,BEAT_04_04,PHASE_CRISIS,REFLECT,NARRATION,You just sit there a little longer than usual.,9,0.5
167,PV_0013,BEAT_04_04,PHASE_CRISIS,REFLECT,NARRATION,With the keyboard.,3,0
168,PV_0013,BEAT_04_04,PHASE_CRISIS,REFLECT,NARRATION,With the screen.,3,0
169,PV_0013,BEAT_04_04,PHASE_CRISIS,REFLECT,NARRATION,With the thing you spent four years building alone in a room nobody knows about.,14,1.0
170,PV_0013,BEAT_04_04,PHASE_CRISIS,REFLECT,NARRATION,You close the laptop.,4,0.5
171,PV_0013,BEAT_04_04,PHASE_CRISIS,REFLECT,NARRATION,The screen goes dark.,4,0.5
172,PV_0013,BEAT_04_04,PHASE_CRISIS,REFLECT,NARRATION,Nobody forced you.,3,0
173,PV_0013,BEAT_04_04,PHASE_CRISIS,REFLECT,NARRATION,Nobody chased you.,3,0
174,PV_0013,BEAT_04_04,PHASE_CRISIS,REFLECT,NARRATION,You just stood up.,4,0.5
175,PV_0013,BEAT_04_04,PHASE_CRISIS,REFLECT,WEIGHT_LINE,And walked away.,3,2.0
176,PV_0013,BEAT_05_01,PHASE_RESOLUTION,TIME_MARKER,NARRATION,The price starts climbing.,4,0.5
177,PV_0013,BEAT_05_01,PHASE_RESOLUTION,TIME_MARKER,NARRATION,One dollar.,2,0
178,PV_0013,BEAT_05_01,PHASE_RESOLUTION,TIME_MARKER,NARRATION,Ten.,1,0
179,PV_0013,BEAT_05_01,PHASE_RESOLUTION,TIME_MARKER,NARRATION,A hundred.,2,0
180,PV_0013,BEAT_05_01,PHASE_RESOLUTION,TIME_MARKER,NARRATION,A thousand.,2,0
181,PV_0013,BEAT_05_01,PHASE_RESOLUTION,TIME_MARKER,NARRATION,Ten thousand.,2,0
182,PV_0013,BEAT_05_01,PHASE_RESOLUTION,TIME_MARKER,NARRATION,Sixty thousand.,2,0.5
183,PV_0013,BEAT_05_01,PHASE_RESOLUTION,TIME_MARKER,NARRATION,You watch from a cafe somewhere.,6,0
184,PV_0013,BEAT_05_01,PHASE_RESOLUTION,TIME_MARKER,NARRATION,Different city now.,3,0
185,PV_0013,BEAT_05_01,PHASE_RESOLUTION,TIME_MARKER,NARRATION,Different laptop.,2,0
186,PV_0013,BEAT_05_01,PHASE_RESOLUTION,TIME_MARKER,NARRATION,Same coffee.,2,0.5
187,PV_0013,BEAT_05_01,PHASE_RESOLUTION,TIME_MARKER,NARRATION,"Your coins - one million of them - sit untouched.",8,0.5
188,PV_0013,BEAT_05_01,PHASE_RESOLUTION,TIME_MARKER,NARRATION,You are the richest person in the world.,7,0
189,PV_0013,BEAT_05_01,PHASE_RESOLUTION,TIME_MARKER,WEIGHT_LINE,On paper.,2,0.5
190,PV_0013,BEAT_05_01,PHASE_RESOLUTION,TIME_MARKER,NARRATION,On a paper that doesn't have your name on it.,10,1.5
191,PV_0013,BEAT_05_02,PHASE_RESOLUTION,REFLECT,NARRATION,The world keeps trying to find you.,6,0
192,PV_0013,BEAT_05_02,PHASE_RESOLUTION,REFLECT,WEIGHT_LINE,You keep not existing.,4,1.0
193,PV_0013,BEAT_05_02,PHASE_RESOLUTION,REFLECT,NARRATION,"Every few years, someone becomes you.",6,0.5
194,PV_0013,BEAT_05_02,PHASE_RESOLUTION,REFLECT,NARRATION,A retired engineer in California gets ambushed by reporters on his front lawn.,13,0
195,PV_0013,BEAT_05_02,PHASE_RESOLUTION,REFLECT,NARRATION,He says he's never heard of Bitcoin.,7,0
196,PV_0013,BEAT_05_02,PHASE_RESOLUTION,REFLECT,NARRATION,He's telling the truth.,4,0
197,PV_0013,BEAT_05_02,PHASE_RESOLUTION,REFLECT,NARRATION,He looks scared.,3,0.5
198,PV_0013,BEAT_05_02,PHASE_RESOLUTION,REFLECT,NARRATION,You wonder if that's what you'd look like.,8,0.5
199,PV_0013,BEAT_05_02,PHASE_RESOLUTION,REFLECT,NARRATION,A man in Australia goes to court claiming he invented it.,10,0
200,PV_0013,BEAT_05_02,PHASE_RESOLUTION,REFLECT,NARRATION,The court disagrees.,3,0.5
201,PV_0013,BEAT_05_02,PHASE_RESOLUTION,REFLECT,NARRATION,He is not you.,4,0.5
202,PV_0013,BEAT_05_02,PHASE_RESOLUTION,REFLECT,NARRATION,"And every time someone claims your name - you let them.",10,1.0
203,PV_0013,BEAT_05_03,PHASE_RESOLUTION,REFLECT,NARRATION,Hal Finney dies in 2014.,5,0.5
204,PV_0013,BEAT_05_03,PHASE_RESOLUTION,REFLECT,NARRATION,ALS.,1,0.5
205,PV_0013,BEAT_05_03,PHASE_RESOLUTION,REFLECT,NARRATION,The first person who ever received your coins.,8,0
206,PV_0013,BEAT_05_03,PHASE_RESOLUTION,REFLECT,NARRATION,The first person who believed.,5,0.5
207,PV_0013,BEAT_05_03,PHASE_RESOLUTION,REFLECT,NARRATION,You can't send flowers.,4,0
208,PV_0013,BEAT_05_03,PHASE_RESOLUTION,REFLECT,NARRATION,You can't attend the funeral.,5,0
209,PV_0013,BEAT_05_03,PHASE_RESOLUTION,REFLECT,NARRATION,You can't even post a single message saying goodbye.,9,0.5
210,PV_0013,BEAT_05_03,PHASE_RESOLUTION,REFLECT,WEIGHT_LINE,Because the moment you speak you destroy everything you built.,10,1.5
211,PV_0013,BEAT_05_03,PHASE_RESOLUTION,REFLECT,NARRATION,So you sit somewhere and you remember him quietly.,9,0
212,PV_0013,BEAT_05_03,PHASE_RESOLUTION,REFLECT,NARRATION,The way you do everything now.,6,1.0
213,PV_0013,BEAT_05_04,PHASE_RESOLUTION,RESOLVE,NARRATION,Digital gold is everywhere now.,5,0.5
214,PV_0013,BEAT_05_04,PHASE_RESOLUTION,RESOLVE,NARRATION,In portfolios.,2,0
215,PV_0013,BEAT_05_04,PHASE_RESOLUTION,RESOLVE,NARRATION,In legislation.,2,0
216,PV_0013,BEAT_05_04,PHASE_RESOLUTION,RESOLVE,NARRATION,In arguments at dinner tables between people who don't understand it.,11,0.5
217,PV_0013,BEAT_05_04,PHASE_RESOLUTION,RESOLVE,NARRATION,And the person who created it is nowhere.,7,1.0
218,PV_0013,BEAT_05_04,PHASE_RESOLUTION,RESOLVE,NARRATION,You sit in a cafe.,5,0
219,PV_0013,BEAT_05_04,PHASE_RESOLUTION,RESOLVE,NARRATION,Someone at the next table says Bitcoin is the future.,9,0
220,PV_0013,BEAT_05_04,PHASE_RESOLUTION,RESOLVE,NARRATION,You nod.,2,0
221,PV_0013,BEAT_05_04,PHASE_RESOLUTION,RESOLVE,NARRATION,Politely.,1,0
222,PV_0013,BEAT_05_04,PHASE_RESOLUTION,RESOLVE,NARRATION,Your hands are warm around the mug.,7,0.5
223,PV_0013,BEAT_05_04,PHASE_RESOLUTION,RESOLVE,NARRATION,You don't correct them.,4,1.0
224,PV_0013,BEAT_06_01,CALLBACK,CALLBACK,NARRATION,The same cafe.,3,0
225,PV_0013,BEAT_06_01,CALLBACK,CALLBACK,NARRATION,The same laptop.,3,0
226,PV_0013,BEAT_06_01,CALLBACK,CALLBACK,NARRATION,The same coffee.,3,0.5
227,PV_0013,BEAT_06_01,CALLBACK,CALLBACK,NARRATION,A stranger leans over.,4,0
228,PV_0013,BEAT_06_01,CALLBACK,CALLBACK,NARRATION,"I wonder where Satoshi is, he says.",7,0.5
229,PV_0013,BEAT_06_01,CALLBACK,CALLBACK,NARRATION,You take a sip.,4,0.5
230,PV_0013,BEAT_06_01,CALLBACK,CALLBACK,NARRATION,You don't answer.,3,1.5
231,PV_0013,BEAT_06_02,CALLBACK,CTA,WEIGHT_LINE,The price of creating digital gold.,6,1.0
232,PV_0013,BEAT_06_02,CALLBACK,CTA,WEIGHT_LINE,Is that you can never claim it as yours.,8,2.0
