VO_ID,Episode_ID,Beat_ID,Life_Phase,Beat_Type,VO_Type,VO_EN,Word_Count_EN,Pause_After
267,PV_0013,BEAT_05_05,PHASE_RESOLUTION,RESOLVE,NARRATION,You don't correct them.,4,1.0
268,PV_0013,BEAT_06_01,CALLBACK,CALLBACK,NARRATION,The same cafe.,3,0
269,PV_0013,BEAT_06_01,CALLBACK,CALLBACK,NARRATION,The same laptop.,3,0
270,PV_0013,BEAT_06_01,CALLBACK,CALLBACK,NARRATION,The same coffee.,3,0.5
271,PV_0013,BEAT_06_01,CALLBACK,CALLBACK,NARRATION,The price is higher than yesterday.,6,0
272,PV_0013,BEAT_06_01,CALLBACK,CALLBACK,NARRATION,It's always higher than yesterday.,5,0.5
273,PV_0013,BEAT_06_01,CALLBACK,CALLBACK,NARRATION,A stranger leans over.,4,0
274,PV_0013,BEAT_06_01,CALLBACK,CALLBACK,NARRATION,"I wonder where Satoshi is, he says.",7,0.5
275,PV_0013,BEAT_06_01,CALLBACK,CALLBACK,NARRATION,You look at your coffee.,5,0
276,PV_0013,BEAT_06_01,CALLBACK,CALLBACK,NARRATION,You take a sip.,4,0.5
277,PV_0013,BEAT_06_01,CALLBACK,CALLBACK,NARRATION,You don't answer.,3,1.5
278,PV_0013,BEAT_06_02,CALLBACK,CTA,WEIGHT_LINE,The price of creating digital gold.,6,1.0
279,PV_0013,BEAT_06_02,CALLBACK,CTA,WEIGHT_LINE,Is that you can never claim it as yours.,8,2.0
