VO_ID,Episode_ID,Beat_ID,Life_Phase,Beat_Type,VO_Type,VO_EN,VO_JA,VO_VI,Word_Count_EN,Pause_After
217,PV_0001,BEAT_06_06,PHASE_PRESENT,REFLECT,NARRATION,"Someone hands you a glass of water. You don't drink it.","誰かが水を一杯渡す。飲まない。","Ai đó đưa bạn ly nước. Bạn không uống.",10,0
218,PV_0001,BEAT_06_06,PHASE_PRESENT,REFLECT,NARRATION,"The seat is narrow. Your knees don't quite fit.","席が狭い。膝が収まらない。","Ghế hơi chật. Đầu gối bạn không vừa.",8,0
219,PV_0001,BEAT_06_06,PHASE_PRESENT,REFLECT,NARRATION,"You're taller than every legislator in the chamber.","議場のすべての議員より背が高い。","Bạn cao hơn mọi nghị sĩ trong phòng.",7,0.5
220,PV_0001,BEAT_06_06b,PHASE_PRESENT,REFLECT,NARRATION,"There are events. Dinners. Things with names.","イベントがある。ディナー。名前のあるもの。","Có những sự kiện. Bữa tối. Những thứ có tên gọi.",8,0
221,PV_0001,BEAT_06_06b,PHASE_PRESENT,REFLECT,NARRATION,"The air feels thick. Too many people.","空気が重い。人が多すぎる。","Không khí đặc quánh. Quá nhiều người.",6,0
222,PV_0001,BEAT_06_06b,PHASE_PRESENT,REFLECT,NARRATION,"You go to some of them.","いくつかは出席する。","Bạn đi một số.",5,0
223,PV_0001,BEAT_06_06b,PHASE_PRESENT,REFLECT,NARRATION,"You stand near the edge of the room because there's no other option. You're too visible anywhere.","他に選択肢がないので部屋の端近くに立つ。どこにいても目立ちすぎる。","Bạn đứng gần mép phòng vì không có lựa chọn khác. Bạn quá dễ nhìn thấy ở đâu cũng vậy.",17,0
224,PV_0001,BEAT_06_06b,PHASE_PRESENT,REFLECT,NARRATION,"Someone always comes up. Someone always has a story about knowing your father.","必ず誰かが近づいてくる。必ず父を知っているという話をする。","Luôn có người tiến lại. Luôn có chuyện về việc quen cha bạn.",12,0
225,PV_0001,BEAT_06_06b,PHASE_PRESENT,REFLECT,NARRATION,"You listen. You nod.","聞く。うなずく。","Bạn nghe. Bạn gật.",4,0
226,PV_0001,BEAT_06_06b,PHASE_PRESENT,REFLECT,NARRATION,"You shake someone's hand. They hold it too long.","誰かと握手する。相手が長く握りすぎる。","Bạn bắt tay ai đó. Họ nắm hơi lâu.",8,0
227,PV_0001,BEAT_06_06b,PHASE_PRESENT,REFLECT,NARRATION,"You check your watch. Then you remember you're not wearing one.","時計を確認する。つけていないことに気づく。","Bạn nhìn đồng hồ. Rồi nhớ ra mình không đeo.",10,0
228,PV_0001,BEAT_06_06b,PHASE_PRESENT,REFLECT,NARRATION,"You look at the window instead.","代わりに窓の外を見る。","Bạn nhìn ra cửa sổ thay vào đó.",6,0.5
229,PV_0001,BEAT_06_07,PHASE_PRESENT,REFLECT,NARRATION,"You still haven't spoken publicly. Not once.","まだ一度も公に発言していない。一度も。","Bạn vẫn chưa một lần phát biểu công khai.",7,0
230,PV_0001,BEAT_06_07,PHASE_PRESENT,REFLECT,NARRATION,"You almost  - ","危うく  - ","Bạn suýt  - ",2,0
231,PV_0001,BEAT_06_07,PHASE_PRESENT,REFLECT,NARRATION,"Nothing.","何もない。","Không có gì.",1,0.3
232,PV_0001,BEAT_06_07,PHASE_PRESENT,REFLECT,NARRATION,"You haven't said a word.","一言も発していない。","Bạn chưa nói một lời nào.",6,0
233,PV_0001,BEAT_06_07,PHASE_PRESENT,REFLECT,NARRATION,"Somehow that's what people remember.","なぜかそれが人々に記憶されている。","Kỳ lạ thay, đó là thứ người ta nhớ về bạn.",6,0.5
234,PV_0001,BEAT_06_07,PHASE_PRESENT,REFLECT,WEIGHT_LINE,"You just sit with it.","それをどうすればいいのか分からない。","Bạn không biết phải làm gì với điều đó.",8,2.0
235,PV_0001,BEAT_06_07,PHASE_PRESENT,REFLECT,NARRATION,"You don't like thinking about any of this.","このことは考えたくない。","Bạn không thích nghĩ về mấy thứ này.",7,0.5
236,PV_0001,BEAT_07_01,CALLBACK_CLOSE,CALLBACK,NARRATION,"Remember the tower? The penthouse in Manhattan?","あのタワーを覚えてる？マンハッタンのペントハウス？","Nhớ toà tháp không? Căn penthouse ở Manhattan?",7,0
237,PV_0001,BEAT_07_01,CALLBACK_CLOSE,CALLBACK,NARRATION,"The floor that was entirely yours?","あなただけのフロア？","Cả tầng là của bạn ấy?",6,0.5
238,PV_0001,BEAT_07_02,CALLBACK_CLOSE,REFLECT,NARRATION,"The whole floor was yours. But you never really lived there.","フロア全体があなたのものだった。でも本当にそこに住んだことはなかった。","Cả tầng là của bạn. Nhưng bạn chưa bao giờ thực sự sống ở đó.",12,1.0
239,PV_0001,BEAT_07_03,CALLBACK_CLOSE,REFLECT,NARRATION,"You are twenty years old.","あなたは二十歳だ。","Bạn hai mươi tuổi.",4,0.5
240,PV_0001,BEAT_07_03b,CALLBACK_CLOSE,REFLECT,NARRATION,"And nobody knows what happens next.","そして次に何が起きるか、誰も知らない。","Và không ai biết chuyện gì xảy ra tiếp theo.",8,0
241,PV_0001,BEAT_07_03b,CALLBACK_CLOSE,REFLECT,NARRATION,"Not even you.","あなたでさえ。","Kể cả bạn.",3,0.5
242,PV_0001,BEAT_07_03b,CALLBACK_CLOSE,REFLECT,NARRATION,"And that's fine.","それでいい。いや、違う。まだ分かっていない。","Và ổn thôi. Hoặc không. Bạn chưa tìm ra.",11,0.5
243,PV_0001,BEAT_07_03b,CALLBACK_CLOSE,REFLECT,NARRATION,"Or it's not.","いや、違う。","Hoặc không.",3,0
244,PV_0001,BEAT_07_03b,CALLBACK_CLOSE,REFLECT,NARRATION,"You leave it there.","まだ分かっていない。","Bạn chưa tìm ra.",6,0.5
245,PV_0001,BEAT_07_03,CALLBACK_CLOSE,REFLECT,WEIGHT_LINE,"And you still have not decided who you are.","そしてまだ、自分が誰なのか決めていない。","Và bạn vẫn chưa quyết định mình là ai.",9,1.5
246,PV_0001,BEAT_07_04,CALLBACK_CLOSE,CTA,WEIGHT_LINE,"But maybe  -  that is the one right no one can take from you.","でもたぶん  -  それが、誰にも奪えないあなたの唯一の権利だ。","Nhưng có lẽ  -  đó là quyền duy nhất không ai lấy được từ bạn.",13,2.0
